{
  "master": {
    "identity": "PYMAPA-KNOWLEDGE-MASTER",
    "version": "1.0",
    "baselineStatus": "BASELINE-APPROVED"
  },
  "capability": {
    "id": "CM-06",
    "domainId": "CM",
    "name": "Medir y gestionar creación de valor",
    "definition": "CM-06 evalúa la capacidad de la organización para definir los resultados de valor materialmente relevantes para clientes y negocio, producir evidencia suficiente sobre su generación, distinguir creación de valor de captura económica y utilizar esa evidencia para gestionar decisiones, trade-offs y sostenibilidad del modelo.",
    "definitionStatus": "EXPLICIT",
    "definitionSourceLines": [
      39,
      39
    ]
  },
  "provenance": {
    "sourceReference": "canonical-baseline.json#CM06-K4-v1.0@sha256:ccb557c8328874e1cc69bcf0036626b38e352c7c27aa62e2e289f6234ec3f65f · CM06-K4-v1.0 · K4-VALIDATED · CLOSED",
    "extractionStatus": "APPROVED",
    "derivation": "MASTER_TRANSCRIPTION",
    "derivationNote": "Proyección genérica determinista (M2-FACTORY-CONTRACT-03) desde baseline canónica aceptada + estructura explícita de la fuente raw sellada.",
    "approvedBy": "PROJECT_OWNER / KNOWLEDGE_GOVERNANCE_AUTHORITY",
    "approvedAt": "2026-09-24"
  },
  "targetPack": {
    "packId": "cm-06",
    "packVersion": "1.0.0"
  },
  "sections": {
    "capability": {
      "id": "CM-06",
      "domainId": "CM",
      "name": "Medir y gestionar creación de valor",
      "definition": "CM-06 evalúa la capacidad de la organización para definir los resultados de valor materialmente relevantes para clientes y negocio, producir evidencia suficiente sobre su generación, distinguir creación de valor de captura económica y utilizar esa evidencia para gestionar decisiones, trade-offs y sostenibilidad del modelo.",
      "definitionStatus": "EXPLICIT",
      "definitionSourceLines": [
        39,
        39
      ]
    },
    "conditionsOfExistence": [
      {
        "id": "CE01",
        "statement": "Value Intent"
      },
      {
        "id": "CE02",
        "statement": "Outcome structure"
      },
      {
        "id": "CE03",
        "statement": "Customer Value"
      },
      {
        "id": "CE04",
        "statement": "Business Value"
      },
      {
        "id": "CE05",
        "statement": "Measurement"
      },
      {
        "id": "CE06",
        "statement": "Attribution"
      },
      {
        "id": "CE07",
        "statement": "Value Capture"
      },
      {
        "id": "CE08",
        "statement": "Trade-offs"
      },
      {
        "id": "CE09",
        "statement": "Management"
      },
      {
        "id": "CE10",
        "statement": "Sustainability/Learning"
      }
    ],
    "variables": [
      {
        "id": "VA01",
        "name": "receptor de valor suficientemente identificado",
        "criticality": "NOT_EXPLICIT_IN_KNOWLEDGE_MASTER",
        "minimumEvidence": "NOT_EXPLICIT_IN_KNOWLEDGE_MASTER",
        "minimumEvidenceResolution": "NOT_EXPLICIT",
        "semanticStates": null,
        "acquisitionResolution": "CAPABILITY_PROGRESSIVE"
      },
      {
        "id": "VA02",
        "name": "resultado de valor esperado suficientemente definido",
        "criticality": "NOT_EXPLICIT_IN_KNOWLEDGE_MASTER",
        "minimumEvidence": "NOT_EXPLICIT_IN_KNOWLEDGE_MASTER",
        "minimumEvidenceResolution": "NOT_EXPLICIT",
        "semanticStates": null,
        "acquisitionResolution": "CAPABILITY_PROGRESSIVE"
      },
      {
        "id": "VA03",
        "name": "output/outcome/impact suficientemente diferenciados",
        "criticality": "NOT_EXPLICIT_IN_KNOWLEDGE_MASTER",
        "minimumEvidence": "NOT_EXPLICIT_IN_KNOWLEDGE_MASTER",
        "minimumEvidenceResolution": "NOT_EXPLICIT",
        "semanticStates": null,
        "acquisitionResolution": "CAPABILITY_PROGRESSIVE"
      },
      {
        "id": "VA04",
        "name": "horizonte del resultado suficientemente claro",
        "criticality": "NOT_EXPLICIT_IN_KNOWLEDGE_MASTER",
        "minimumEvidence": "NOT_EXPLICIT_IN_KNOWLEDGE_MASTER",
        "minimumEvidenceResolution": "NOT_EXPLICIT",
        "semanticStates": null,
        "acquisitionResolution": "CAPABILITY_PROGRESSIVE"
      },
      {
        "id": "VA05",
        "name": "resultado material para cliente suficientemente definido",
        "criticality": "NOT_EXPLICIT_IN_KNOWLEDGE_MASTER",
        "minimumEvidence": "NOT_EXPLICIT_IN_KNOWLEDGE_MASTER",
        "minimumEvidenceResolution": "NOT_EXPLICIT",
        "semanticStates": null,
        "acquisitionResolution": "CAPABILITY_PROGRESSIVE"
      },
      {
        "id": "VA06",
        "name": "evidencia de customer value suficientemente disponible",
        "criticality": "NOT_EXPLICIT_IN_KNOWLEDGE_MASTER",
        "minimumEvidence": "NOT_EXPLICIT_IN_KNOWLEDGE_MASTER",
        "minimumEvidenceResolution": "NOT_EXPLICIT",
        "semanticStates": null,
        "acquisitionResolution": "CAPABILITY_PROGRESSIVE"
      },
      {
        "id": "VA07",
        "name": "resultado material para negocio suficientemente definido",
        "criticality": "NOT_EXPLICIT_IN_KNOWLEDGE_MASTER",
        "minimumEvidence": "NOT_EXPLICIT_IN_KNOWLEDGE_MASTER",
        "minimumEvidenceResolution": "NOT_EXPLICIT",
        "semanticStates": null,
        "acquisitionResolution": "CAPABILITY_PROGRESSIVE"
      },
      {
        "id": "VA08",
        "name": "evidencia económica/estratégica suficientemente disponible",
        "criticality": "NOT_EXPLICIT_IN_KNOWLEDGE_MASTER",
        "minimumEvidence": "NOT_EXPLICIT_IN_KNOWLEDGE_MASTER",
        "minimumEvidenceResolution": "NOT_EXPLICIT",
        "semanticStates": null,
        "acquisitionResolution": "CAPABILITY_PROGRESSIVE"
      },
      {
        "id": "VA09",
        "name": "métricas suficientemente relevantes",
        "criticality": "NOT_EXPLICIT_IN_KNOWLEDGE_MASTER",
        "minimumEvidence": "NOT_EXPLICIT_IN_KNOWLEDGE_MASTER",
        "minimumEvidenceResolution": "NOT_EXPLICIT",
        "semanticStates": null,
        "acquisitionResolution": "CAPABILITY_PROGRESSIVE"
      },
      {
        "id": "VA10",
        "name": "baseline/comparador suficiente cuando aplica",
        "criticality": "NOT_EXPLICIT_IN_KNOWLEDGE_MASTER",
        "minimumEvidence": "NOT_EXPLICIT_IN_KNOWLEDGE_MASTER",
        "minimumEvidenceResolution": "NOT_EXPLICIT",
        "semanticStates": null,
        "acquisitionResolution": "CAPABILITY_PROGRESSIVE"
      },
      {
        "id": "VA11",
        "name": "calidad/oportunidad de información suficiente",
        "criticality": "NOT_EXPLICIT_IN_KNOWLEDGE_MASTER",
        "minimumEvidence": "NOT_EXPLICIT_IN_KNOWLEDGE_MASTER",
        "minimumEvidenceResolution": "NOT_EXPLICIT",
        "semanticStates": null,
        "acquisitionResolution": "CAPABILITY_PROGRESSIVE"
      },
      {
        "id": "VA12",
        "name": "factores contribuyentes suficientemente visibles",
        "criticality": "NOT_EXPLICIT_IN_KNOWLEDGE_MASTER",
        "minimumEvidence": "NOT_EXPLICIT_IN_KNOWLEDGE_MASTER",
        "minimumEvidenceResolution": "NOT_EXPLICIT",
        "semanticStates": null,
        "acquisitionResolution": "CAPABILITY_PROGRESSIVE"
      },
      {
        "id": "VA13",
        "name": "nivel de atribución proporcional a evidencia",
        "criticality": "NOT_EXPLICIT_IN_KNOWLEDGE_MASTER",
        "minimumEvidence": "NOT_EXPLICIT_IN_KNOWLEDGE_MASTER",
        "minimumEvidenceResolution": "NOT_EXPLICIT",
        "semanticStates": null,
        "acquisitionResolution": "CAPABILITY_PROGRESSIVE"
      },
      {
        "id": "VA14",
        "name": "incertidumbre material suficientemente explícita",
        "criticality": "NOT_EXPLICIT_IN_KNOWLEDGE_MASTER",
        "minimumEvidence": "NOT_EXPLICIT_IN_KNOWLEDGE_MASTER",
        "minimumEvidenceResolution": "NOT_EXPLICIT",
        "semanticStates": null,
        "acquisitionResolution": "CAPABILITY_PROGRESSIVE"
      },
      {
        "id": "VA15",
        "name": "mecanismo de captura suficientemente claro",
        "criticality": "NOT_EXPLICIT_IN_KNOWLEDGE_MASTER",
        "minimumEvidence": "NOT_EXPLICIT_IN_KNOWLEDGE_MASTER",
        "minimumEvidenceResolution": "NOT_EXPLICIT",
        "semanticStates": null,
        "acquisitionResolution": "CAPABILITY_PROGRESSIVE"
      },
      {
        "id": "VA16",
        "name": "economics materiales suficientemente conocidos cuando aplican",
        "criticality": "NOT_EXPLICIT_IN_KNOWLEDGE_MASTER",
        "minimumEvidence": "NOT_EXPLICIT_IN_KNOWLEDGE_MASTER",
        "minimumEvidenceResolution": "NOT_EXPLICIT",
        "semanticStates": null,
        "acquisitionResolution": "CAPABILITY_PROGRESSIVE"
      },
      {
        "id": "VA17",
        "name": "trade-offs materiales suficientemente identificados",
        "criticality": "NOT_EXPLICIT_IN_KNOWLEDGE_MASTER",
        "minimumEvidence": "NOT_EXPLICIT_IN_KNOWLEDGE_MASTER",
        "minimumEvidenceResolution": "NOT_EXPLICIT",
        "semanticStates": null,
        "acquisitionResolution": "CAPABILITY_PROGRESSIVE"
      },
      {
        "id": "VA18",
        "name": "value leakage suficientemente visible",
        "criticality": "NOT_EXPLICIT_IN_KNOWLEDGE_MASTER",
        "minimumEvidence": "NOT_EXPLICIT_IN_KNOWLEDGE_MASTER",
        "minimumEvidenceResolution": "NOT_EXPLICIT",
        "semanticStates": null,
        "acquisitionResolution": "CAPABILITY_PROGRESSIVE"
      },
      {
        "id": "VA19",
        "name": "destrucción de valor suficientemente detectable",
        "criticality": "NOT_EXPLICIT_IN_KNOWLEDGE_MASTER",
        "minimumEvidence": "NOT_EXPLICIT_IN_KNOWLEDGE_MASTER",
        "minimumEvidenceResolution": "NOT_EXPLICIT",
        "semanticStates": null,
        "acquisitionResolution": "CAPABILITY_PROGRESSIVE"
      },
      {
        "id": "VA20",
        "name": "decisiones pueden modificarse desde evidencia de valor",
        "criticality": "NOT_EXPLICIT_IN_KNOWLEDGE_MASTER",